{
  "集": 1,
  "视频": "videos/sample/E01.mp4",
  "校对完成": true,
  "人物": [
    {
      "id": "H01",
      "名称": "林舟",
      "外观": "黑色西装、短发",
      "出现": [
        "00:00.0-00:30.0"
      ]
    },
    {
      "id": "H02",
      "名称": "沈宁",
      "外观": "白衬衫、长发",
      "出现": [
        "00:00.0-00:30.0"
      ]
    }
  ],
  "台词": [
    {
      "id": "L001",
      "起": "00:02.0",
      "止": "00:03.0",
      "文本": "今天必须说清楚。",
      "说话人": "H01",
      "形态": "画内"
    },
    {
      "id": "L002",
      "起": "00:05.0",
      "止": "00:06.0",
      "文本": "原件在这里。",
      "说话人": "H02",
      "形态": "画内"
    },
    {
      "id": "L003",
      "起": "00:08.0",
      "止": "00:09.0",
      "文本": "先把门打开。",
      "说话人": "H01",
      "形态": "画内"
    },
    {
      "id": "L004",
      "起": "00:11.0",
      "止": "00:12.0",
      "文本": "把信封给我。",
      "说话人": "H02",
      "形态": "画内"
    },
    {
      "id": "L005",
      "起": "00:14.0",
      "止": "00:15.0",
      "文本": "我已经看过了。",
      "说话人": "H01",
      "形态": "画内"
    },
    {
      "id": "L006",
      "起": "00:17.0",
      "止": "00:18.0",
      "文本": "现在可以走了。",
      "说话人": "H02",
      "形态": "画内"
    }
  ],
  "关键动作": [
    {
      "id": "M001",
      "起": "00:03.0",
      "止": "00:03.5",
      "执行者": "H01",
      "动作": "右掌拍在桌面上",
      "对象": "桌面",
      "物件": null,
      "结果": "水杯晃动",
      "类别": 4
    },
    {
      "id": "M002",
      "起": "00:07.0",
      "止": "00:07.5",
      "执行者": "H02",
      "动作": "推开木门",
      "对象": "木门",
      "物件": null,
      "结果": "木门打开",
      "类别": 3
    },
    {
      "id": "M003",
      "起": "00:11.0",
      "止": "00:11.5",
      "执行者": "H01",
      "动作": "举起文件",
      "对象": "文件",
      "物件": "文件",
      "结果": "文件举到胸前",
      "类别": 4
    },
    {
      "id": "M004",
      "起": "00:15.0",
      "止": "00:15.5",
      "执行者": "H02",
      "动作": "把信封递给林舟",
      "对象": "H01",
      "物件": "信封",
      "结果": "林舟接住信封",
      "类别": 1
    }
  ]
}
