{
  "集": 1,
  "视频": "videos/sample/E01.mp4",
  "校对完成": false,
  "人物": [
    {
      "id": "H01",
      "名称": "小孩",
      "外观": "小孩",
      "出现": [],
      "待核对": ""
    },
    {
      "id": "H02",
      "名称": "司机",
      "外观": "未出现人物",
      "出现": [],
      "待核对": ""
    },
    {
      "id": "H03",
      "名称": "奶奶",
      "外观": "奶奶",
      "出现": [],
      "待核对": ""
    },
    {
      "id": "H04",
      "名称": "打麻将路人 A",
      "外观": "麻将路人 A，",
      "出现": [],
      "待核对": ""
    },
    {
      "id": "H05",
      "名称": "小孩妈妈",
      "外观": "小孩的妈妈 ",
      "出现": [],
      "待核对": ""
    },
    {
      "id": "H06",
      "名称": "保安",
      "外观": "保安服保安",
      "出现": [],
      "待核对": ""
    },
    {
      "id": "H07",
      "名称": "打麻将路人 B",
      "外观": "打麻将的路人B",
      "出现": [],
      "待核对": ""
    },
    {
      "id": "H08",
      "名称": "打麻将路人 C",
      "外观": "打麻将路人 C",
      "出现": [],
      "待核对": ""
    }
  ],
  "台词": [
    {
      "id": "L001",
      "起": "00:00.1",
      "止": "00:01.0",
      "文本": "奶奶奶奶",
      "说话人": "H01",
      "形态": "画内"
    },
    {
      "id": "L002",
      "起": "00:01.5",
      "止": "00:02.5",
      "文本": "你等等我",
      "说话人": null,
      "形态": null
    },
    {
      "id": "L003",
      "起": "00:03.3",
      "止": "00:04.4",
      "文本": "小孩让开",
      "说话人": "H02",
      "形态": "画外"
    },
    {
      "id": "L004",
      "起": "00:05.6",
      "止": "00:06.1",
      "文本": "糊啦",
      "说话人": "H03",
      "形态": "画内"
    },
    {
      "id": "L005",
      "起": "00:08.1",
      "止": "00:09.6",
      "文本": "桂芝你电话响半天了",
      "说话人": "H04",
      "形态": "画内"
    },
    {
      "id": "L006",
      "起": "00:09.8",
      "止": "00:11.2",
      "文本": "不会是你孙女出什么事了吧",
      "说话人": "H04",
      "形态": "画内"
    },
    {
      "id": "L007",
      "起": "00:11.6",
      "止": "00:12.1",
      "文本": "能出什么事",
      "说话人": "H03",
      "形态": "画内"
    },
    {
      "id": "L008",
      "起": "00:12.6",
      "止": "00:12.9",
      "文本": "老师看着呢",
      "说话人": "H03",
      "形态": "画内"
    },
    {
      "id": "L009",
      "起": "00:14.5",
      "止": "00:15.4",
      "文本": "朵朵呢我问你",
      "说话人": "H05",
      "形态": "画内"
    },
    {
      "id": "L010",
      "起": "00:15.8",
      "止": "00:15.8",
      "文本": "我女儿呢",
      "说话人": "H05",
      "形态": "画内"
    },
    {
      "id": "L011",
      "起": "00:21.1",
      "止": "00:22.0",
      "文本": "喂又怎么了",
      "说话人": "H03",
      "形态": null
    },
    {
      "id": "L012",
      "起": "00:22.2",
      "止": "00:23.7",
      "文本": "妈等会别忘了接朵朵",
      "说话人": "H05",
      "形态": null
    },
    {
      "id": "L013",
      "起": "00:23.9",
      "止": "00:24.8",
      "文本": "你自己看看几点",
      "说话人": "H03",
      "形态": "画内"
    },
    {
      "id": "L014",
      "起": "00:25.2",
      "止": "00:25.8",
      "文本": "放学还有半个小时呢",
      "说话人": "H03",
      "形态": "画内"
    },
    {
      "id": "L015",
      "起": "00:26.4",
      "止": "00:27.6",
      "文本": "我人都杵幼儿园门口了",
      "说话人": "H03",
      "形态": "画内"
    },
    {
      "id": "L016",
      "起": "00:27.8",
      "止": "00:29.1",
      "文本": "妈我就提醒一句",
      "说话人": "H05",
      "形态": "画外"
    },
    {
      "id": "L017",
      "起": "00:29.3",
      "止": "00:30.2",
      "文本": "接个孩子而已",
      "说话人": "H03",
      "形态": "画内"
    },
    {
      "id": "L018",
      "起": "00:31.3",
      "止": "00:32.2",
      "文本": "你一天800个电话",
      "说话人": "H03",
      "形态": "画内"
    },
    {
      "id": "L019",
      "起": "00:32.8",
      "止": "00:33.7",
      "文本": "跟查我岗似的",
      "说话人": "H03",
      "形态": "画内"
    },
    {
      "id": "L020",
      "起": "00:34.1",
      "止": "00:34.6",
      "文本": "我没查你",
      "说话人": "H05",
      "形态": "画外"
    },
    {
      "id": "L021",
      "起": "00:35.2",
      "止": "00:36.1",
      "文本": "我就是怕孩子等",
      "说话人": "H05",
      "形态": "画外"
    },
    {
      "id": "L022",
      "起": "00:37.8",
      "止": "00:38.7",
      "文本": "今天来的够早啊",
      "说话人": "H06",
      "形态": "画内"
    },
    {
      "id": "L023",
      "起": "00:39.3",
      "止": "00:39.8",
      "文本": "什么叫今天",
      "说话人": "H03",
      "形态": "画内"
    },
    {
      "id": "L024",
      "起": "00:40.5",
      "止": "00:42.1",
      "文本": "我哪天接我孙女不积极",
      "说话人": "H03",
      "形态": "画内"
    },
    {
      "id": "L025",
      "起": "00:43.7",
      "止": "00:45.0",
      "文本": "看清楚3:40",
      "说话人": "H03",
      "形态": "画内"
    },
    {
      "id": "L026",
      "起": "00:45.2",
      "止": "00:46.6",
      "文本": "今天我提前半小时站这",
      "说话人": "H03",
      "形态": "画内"
    },
    {
      "id": "L027",
      "起": "00:45.5",
      "止": "00:45.5",
      "文本": "18克0日・黑税二目",
      "说话人": null,
      "形态": null
    },
    {
      "id": "L028",
      "起": "00:47.0",
      "止": "00:48.0",
      "文本": "我看谁还能说我迟到",
      "说话人": "H03",
      "形态": "画内"
    },
    {
      "id": "L029",
      "起": "00:49.9",
      "止": "00:49.9",
      "文本": "当丫孤梨",
      "说话人": null,
      "形态": null
    },
    {
      "id": "L030",
      "起": "00:50.3",
      "止": "00:50.8",
      "文本": "桂芝人呢",
      "说话人": "H07",
      "形态": "画外"
    },
    {
      "id": "L031",
      "起": "00:51.1",
      "止": "00:51.3",
      "文本": "幼儿园门口啊",
      "说话人": "H03",
      "形态": "画内"
    },
    {
      "id": "L032",
      "起": "00:51.8",
      "止": "00:52.6",
      "文本": "接孙女呢",
      "说话人": "H03",
      "形态": "画内"
    },
    {
      "id": "L033",
      "起": "00:53.0",
      "止": "00:54.2",
      "文本": "快过来幼儿园对面棋牌室",
      "说话人": "H07",
      "形态": "画外"
    },
    {
      "id": "L034",
      "起": "00:55.2",
      "止": "00:56.2",
      "文本": "三缺一就差你一个",
      "说话人": "H07",
      "形态": "画外"
    },
    {
      "id": "L035",
      "起": "00:56.4",
      "止": "00:56.8",
      "文本": "不去不去",
      "说话人": "H03",
      "形态": "画内"
    },
    {
      "id": "L036",
      "起": "00:57.4",
      "止": "00:58.3",
      "文本": "我还得接孙女呢",
      "说话人": "H03",
      "形态": "画内"
    },
    {
      "id": "L037",
      "起": "00:58.5",
      "止": "00:59.9",
      "文本": "这不还没放学吗",
      "说话人": "H07",
      "形态": "画外"
    },
    {
      "id": "L038",
      "起": "01:00.4",
      "止": "01:00.8",
      "文本": "就一把",
      "说话人": "H07",
      "形态": "画外"
    },
    {
      "id": "L039",
      "起": "01:01.2",
      "止": "01:02.6",
      "文本": "朵朵4:10才出来",
      "说话人": "H07",
      "形态": "画外"
    },
    {
      "id": "L040",
      "起": "01:03.0",
      "止": "01:04.3",
      "文本": "现在还有20多分钟",
      "说话人": "H07",
      "形态": "画外"
    },
    {
      "id": "L041",
      "起": "01:04.5",
      "止": "01:05.9",
      "文本": "你在门口傻站着也是等",
      "说话人": "H07",
      "形态": "画外"
    },
    {
      "id": "L042",
      "起": "01:06.3",
      "止": "01:07.1",
      "文本": "过来打两圈",
      "说话人": "H07",
      "形态": "画外"
    },
    {
      "id": "L043",
      "起": "01:07.7",
      "止": "01:09.0",
      "文本": "放学前回去不就完了",
      "说话人": "H07",
      "形态": "画外"
    },
    {
      "id": "L044",
      "起": "01:09.2",
      "止": "01:09.6",
      "文本": "说好了啊",
      "说话人": "H03",
      "形态": "画内"
    },
    {
      "id": "L045",
      "起": "01:10.1",
      "止": "01:11.8",
      "文本": "就一把打完我立马走",
      "说话人": "H03",
      "形态": "画内"
    },
    {
      "id": "L046",
      "起": "01:12.0",
      "止": "01:14.0",
      "文本": "行行行就等你了赶紧的",
      "说话人": "H07",
      "形态": "画外"
    },
    {
      "id": "L047",
      "起": "01:16.3",
      "止": "01:17.6",
      "文本": "哎呦可算把你盼来了",
      "说话人": "H04",
      "形态": "画内"
    },
    {
      "id": "L048",
      "起": "01:17.8",
      "止": "01:18.2",
      "文本": "快坐快坐",
      "说话人": "H08",
      "形态": "画内"
    },
    {
      "id": "L049",
      "起": "01:18.5",
      "止": "01:19.2",
      "文本": "牌都摆好了",
      "说话人": "H08",
      "形态": "画内"
    },
    {
      "id": "L050",
      "起": "01:20.5",
      "止": "01:21.7",
      "文本": "先把话说前头啊",
      "说话人": "H03",
      "形态": "画内"
    },
    {
      "id": "L051",
      "起": "01:21.9",
      "止": "01:22.8",
      "文本": "我就打一把",
      "说话人": "H03",
      "形态": "画内"
    },
    {
      "id": "L052",
      "起": "01:23.3",
      "止": "01:25.2",
      "文本": "4:10我得去接我孙女",
      "说话人": "H03",
      "形态": "画内"
    },
    {
      "id": "L053",
      "起": "01:25.4",
      "止": "01:25.8",
      "文本": "知道知道",
      "说话人": null,
      "形态": null
    },
    {
      "id": "L054",
      "起": "01:26.4",
      "止": "01:27.5",
      "文本": "耽误不了你接宝贝孙女",
      "说话人": "H07",
      "形态": "画内"
    },
    {
      "id": "L055",
      "起": "01:27.7",
      "止": "01:28.3",
      "文本": "那还磨蹭什么",
      "说话人": "H03",
      "形态": "画内"
    },
    {
      "id": "L056",
      "起": "01:28.6",
      "止": "01:29.0",
      "文本": "赶紧洗牌",
      "说话人": "H03",
      "形态": "画内"
    }
  ],
  "关键动作": []
}
